{
  "version": 1,
  "cadence": [
    180,
    300,
    60,
    120,
    25,
    45
  ],
  "deep_scale": 0.7,
  "safe_radius": 650,
  "chatter_seconds": [
    22,
    46
  ],
  "weights": [
    18,
    20,
    15,
    8,
    8,
    9,
    8,
    8,
    1,
    12,
    7
  ],
  "messages": [
    "Pirate wing closing for an ambush.",
    "Freighter convoy with Blacktip escort.",
    "Police patrol: transponders ready.",
    "Bounty hunters tracking your signal.",
    "Derelict drifting; cargo nearby.",
    "Distress call: supplies requested.",
    "Smugglers fleeing a police pair.",
    "Prospector working the asteroid belt.",
    "Frill drones: all ships take cover.",
    "Goblin explorer passing through.",
    "Lantern beacon marks loose salvage."
  ],
  "chatter": [
    "Control: keep the approach lane clear.",
    "Control: inbound slot is now clear.",
    "Control: outbound traffic has priority.",
    "Control: hold outside the docking lane.",
    "Control: safe passage to all vessels.",
    "Control: cargo manifests ready, please.",
    "Control: station services are open.",
    "Control: reduce speed near the slot.",
    "Control: watch for departing shuttles.",
    "Control: welcome to local space.",
    "Control: report debris in the lane.",
    "Control: docking lights are steady.",
    "Control: freighters use the outer lane.",
    "Control: rescue vessels have priority.",
    "Control: mind your approach vector.",
    "Control: departure clearance confirmed.",
    "Police: routine patrol on this channel.",
    "Police: keep weapons on safe.",
    "Police: checking local transponders.",
    "Police: report suspicious contacts.",
    "Police: traders, maintain your course.",
    "Police: patrol pair holding formation.",
    "Police: no firing near the station.",
    "Police: scanning the outbound lane.",
    "Police: all clear on this vector.",
    "Police: escort available on request.",
    "Police: watching the jump boundary.",
    "Police: keep your registry current.",
    "Police: rescue beacon acknowledged.",
    "Police: watch your relative speed.",
    "Police: traffic, leave room to pass.",
    "Police: patrol returning to base.",
    "Trader: long haul, short fuel margin.",
    "Trader: anyone buying machine parts?",
    "Trader: convoy holding close today.",
    "Trader: good to see another ship.",
    "Trader: station coffee had better last.",
    "Trader: quiet lanes make good profits.",
    "Trader: watching for loose canisters.",
    "Trader: freight secured for arrival.",
    "Trader: escort, stay on our flank.",
    "Trader: this cargo dislikes rough turns.",
    "Trader: next stop, a warm berth.",
    "Trader: clear skies on your run.",
    "Trader: checking the next market.",
    "Trader: engines sound good today.",
    "Trader: leaving room for the shuttle.",
    "Trader: our hold is full of promises.",
    "Pirate: nice hold you have there.",
    "Pirate: escorts cannot watch all sides.",
    "Pirate: keep those cargo doors handy.",
    "Pirate: lonely route for a full hold.",
    "Pirate: we prefer a peaceful donation.",
    "Pirate: your wake is easy to follow.",
    "Pirate: wings, close up on the mark.",
    "Pirate: that freight looks expensive.",
    "Pirate: no toll receipt on this lane.",
    "Pirate: turn slowly, little trader.",
    "Pirate: we saw you leave the market.",
    "Pirate: spare cargo beats spare parts.",
    "Pirate: the outer lanes are ours.",
    "Pirate: call this a freight inspection.",
    "Pirate: stay calm and open the hold.",
    "Pirate: your escort looks distracted."
  ]
}
